{
  "opendb_id": "004c70a3-272d-48a9-a448-96d006f10d55",
  "metadata": {
    "name": "Lian Li LANCOOL 216 ATX Mid Tower White Tinted Tempered Glass RGB w/Controller",
    "manufacturer": "Lian Li",
    "part_numbers": [
      "LANCOOL 216RC-W                                                    G99.LAN216RCW.00"
    ],
    "series": "LANCOOL",
    "variant": ""
  },
  "form_factor": "ATX Mid Tower",
  "color": [
    "WHITE"
  ],
  "power_supply": "None",
  "side_panel": "Tinted Tempered Glass",
  "has_transparent_side_panel": true,
  "front_panel_usb": "USB 3.2 Gen 2 Type-C                                                    USB 3.2 Gen 1 Type-A",
  "max_video_card_length": 392,
  "max_cpu_cooler_height": null,
  "internal_3_5_bays": 2,
  "internal_2_5_bays": 4,
  "expansion_slots": 7,
  "dimensions": "480.9 x 235 x 491.7",
  "volume": 55.568,
  "weight": null,
  "supported_power_supply_form_factors": [],
  "front_usb_ports": [],
  "general_product_information": {}
}