{
  "opendb_id": "c9c24a91-2f62-4c99-9137-d8926f11275e",
  "metadata": {
    "name": "Thermaltake Core P3 ATX Mid Tower Snow Edition Acrylic Side Panel",
    "manufacturer": "Thermaltake",
    "part_numbers": [
      "CA-1G4-00M6WN-02"
    ],
    "series": "Core",
    "variant": ""
  },
  "form_factor": "ATX Mid Tower",
  "color": [
    "WHITE"
  ],
  "power_supply": "None",
  "side_panel": "Acrylic",
  "has_transparent_side_panel": true,
  "front_panel_usb": "USB 3.2 Gen 1 Type-A                                                    USB 2.0 Type-A",
  "max_video_card_length": 450,
  "max_cpu_cooler_height": null,
  "internal_3_5_bays": 2,
  "internal_2_5_bays": 0,
  "expansion_slots": 8,
  "dimensions": "470 x 333 x 512",
  "volume": 80.133,
  "weight": null,
  "supported_power_supply_form_factors": [],
  "front_usb_ports": [],
  "general_product_information": {}
}