{
  "opendb_id": "4bc90841-ad34-48b4-b8a6-0ac0447eb1cd",
  "metadata": {
    "name": "Empire Gaming Warfare ATX Mid Tower Black with Acrylic Side Panel and USB 3.2 Gen 1 Type-A USB 2.0 Type-A",
    "manufacturer": "Empire Gaming",
    "part_numbers": [
      "OE-CA-11RE"
    ],
    "series": "Warfare",
    "variant": ""
  },
  "form_factor": "ATX Mid Tower",
  "color": [
    "BLACK"
  ],
  "power_supply": "None",
  "side_panel": "Acrylic",
  "has_transparent_side_panel": true,
  "front_panel_usb": "USB 3.2 Gen 1 Type-A                                                    USB 2.0 Type-A",
  "max_video_card_length": 380,
  "max_cpu_cooler_height": null,
  "internal_3_5_bays": 2,
  "internal_2_5_bays": 2,
  "expansion_slots": 7,
  "dimensions": "470 x 223 x 470",
  "volume": 49.261,
  "weight": null,
  "supported_power_supply_form_factors": [],
  "front_usb_ports": [],
  "general_product_information": {}
}