{
  "opendb_id": "c9f86dd2-c861-482b-8ef0-7b5e3914af9f",
  "metadata": {
    "name": "Thermaltake Commander MS-I ID ATX Mid Tower Black Acrylic Side Panel, USB 3.2 Gen 1 Type-A, USB 2.0 Type-A",
    "manufacturer": "Thermaltake",
    "part_numbers": [
      "VN400A1W2N"
    ],
    "series": "Commander",
    "variant": ""
  },
  "form_factor": "ATX Mid Tower",
  "color": [
    "BLACK"
  ],
  "power_supply": "None",
  "side_panel": "Acrylic",
  "has_transparent_side_panel": true,
  "front_panel_usb": "USB 3.2 Gen 1 Type-A                                                    USB 2.0 Type-A",
  "max_video_card_length": 320,
  "max_cpu_cooler_height": null,
  "internal_3_5_bays": 5,
  "internal_2_5_bays": 1,
  "expansion_slots": 7,
  "dimensions": "485 x 200 x 424",
  "volume": 41.128,
  "weight": null,
  "supported_power_supply_form_factors": [],
  "front_usb_ports": [],
  "general_product_information": {}
}