{
  "opendb_id": "2cbde545-c52d-4ed3-b5fb-01e248cb2416",
  "metadata": {
    "name": "Fractal Design Define Mini C MicroATX Mid Tower Black Acrylic Side Panel",
    "manufacturer": "Fractal Design",
    "part_numbers": [
      "FD-CA-DEF-MINI-C-BK-W"
    ],
    "series": "Define",
    "variant": ""
  },
  "form_factor": "Micro ATX Mid Tower",
  "color": [
    "BLACK"
  ],
  "power_supply": "None",
  "side_panel": "Acrylic",
  "has_transparent_side_panel": true,
  "front_panel_usb": "USB 3.2 Gen 1 Type-A",
  "max_video_card_length": 315,
  "max_cpu_cooler_height": null,
  "internal_3_5_bays": 2,
  "internal_2_5_bays": 3,
  "expansion_slots": 5,
  "dimensions": "413 x 210 x 412",
  "volume": 35.733,
  "weight": null,
  "supported_power_supply_form_factors": [],
  "front_usb_ports": [],
  "general_product_information": {}
}