{
  "opendb_id": "e6bffbcc-52cc-48b2-8cab-38e991a2c436",
  "metadata": {
    "name": "Thermaltake Ceres 350 MX ATX Mid Tower Yellow Tempered Glass Side Panel, USB 3.2 Gen 2 Type-C and USB 3.2 Gen 1 Type-A Front Panel",
    "manufacturer": "Thermaltake",
    "part_numbers": [
      "CA-1Z3-00M4WN-00"
    ],
    "series": "Ceres",
    "variant": ""
  },
  "form_factor": "ATX Mid Tower",
  "color": [
    "YELLOW"
  ],
  "power_supply": "None",
  "side_panel": "Tempered Glass",
  "has_transparent_side_panel": true,
  "front_panel_usb": "USB 3.2 (Gen 2) Type-C x 1                                                             USB 3.0 x 2",
  "max_video_card_length": 370,
  "max_cpu_cooler_height": 185,
  "internal_3_5_bays": 1,
  "internal_2_5_bays": 2,
  "expansion_slots": 7,
  "dimensions": "463 x 245 x 463",
  "volume": 52.52,
  "weight": 19.51,
  "supported_power_supply_form_factors": [],
  "front_usb_ports": [
    "USB 3.2 (Gen 2) Type-C x 1",
    "USB 3.0 x 2"
  ],
  "dimensions_mm": {
    "width": 245,
    "height": 463,
    "depth": 463,
    "_id": "68d1129e766d8d1e2706ce61"
  },
  "general_product_information": {
    "amazon_sku": "B0DFN15FG6",
    "newegg_sku": "N82E16811133554",
    "walmart_sku": 11449167624
  }
}