{
  "opendb_id": "e65be103-0c8b-4b59-a9f8-f226c8a931c9",
  "metadata": {
    "name": "iBuypower Slate 8 Mesh Pro ARGB ATX Mid Tower Black Tempered Glass Side Panel, USB 3.2 Gen 2 Type-C, USB 3.2 Gen 1 Type-A",
    "manufacturer": "iBUYPOWER",
    "part_numbers": [
      "848604047782"
    ],
    "series": "Slate",
    "variant": ""
  },
  "form_factor": "ATX Mid Tower",
  "color": [
    "BLACK"
  ],
  "power_supply": "None",
  "side_panel": "Tempered Glass",
  "has_transparent_side_panel": true,
  "front_panel_usb": "USB 3.2 Gen 2 Type-C                                                    USB 3.2 Gen 1 Type-A",
  "max_video_card_length": 400,
  "max_cpu_cooler_height": null,
  "internal_3_5_bays": 1,
  "internal_2_5_bays": 2,
  "expansion_slots": 7,
  "dimensions": "501 x 220 x 492",
  "volume": 54.228,
  "weight": null,
  "supported_power_supply_form_factors": [],
  "front_usb_ports": [],
  "general_product_information": {}
}