{
  "opendb_id": "3be281f2-8527-4ecd-8b0f-b943e3f77acb",
  "metadata": {
    "name": "Thermaltake V100 ATX Mid Tower Black w/500 W Power Supply",
    "manufacturer": "Thermaltake",
    "part_numbers": [
      "CA-3K7-50M1NA-00"
    ],
    "series": "V100",
    "variant": ""
  },
  "form_factor": "ATX Mid Tower",
  "color": [
    "BLACK"
  ],
  "power_supply": "500 W",
  "side_panel": "None",
  "has_transparent_side_panel": false,
  "front_panel_usb": "USB 3.2 Gen 1 Type-A                                                    USB 2.0 Type-A",
  "max_video_card_length": 400,
  "max_cpu_cooler_height": null,
  "internal_3_5_bays": 2,
  "internal_2_5_bays": 2,
  "expansion_slots": 7,
  "dimensions": "410 x 190 x 470",
  "volume": 36.613,
  "weight": null,
  "supported_power_supply_form_factors": [],
  "front_usb_ports": [],
  "general_product_information": {}
}