{
  "opendb_id": "0579bb64-a706-4b2d-b880-eaf6b8c6c602",
  "metadata": {
    "name": "Fractal Design Era ITX Mini Tower Case (Carbon with Tempered Glass)",
    "manufacturer": "Fractal Design",
    "part_numbers": [
      "FD-CA-ERA-ITX-BK"
    ],
    "series": "Era",
    "variant": "Carbon"
  },
  "form_factor": "Mini-ITX Tower",
  "power_supply": null,
  "power_supply_included": false,
  "side_panel": "Aluminum",
  "has_transparent_side_panel": false,
  "front_panel_usb": "USB 3.1 Gen 2 Type-C, USB 3.0 (2)",
  "max_video_card_length": 295,
  "max_cpu_cooler_height": 120,
  "internal_3_5_bays": 2,
  "internal_2_5_bays": 4,
  "expansion_slots": 2,
  "dimensions": "166 x 310 x 325",
  "volume": 0,
  "weight": 10.87,
  "color": [],
  "supported_power_supply_form_factors": [],
  "front_usb_ports": [],
  "general_product_information": {
    "amazon_sku": "B08157SB87",
    "newegg_sku": "9SIA4REJUJ1939",
    "walmart_sku": 919167585
  }
}