{
  "opendb_id": "79d32ac6-3ab4-4939-b0e3-1be224501488",
  "metadata": {
    "name": "Antec NX416L ATX Mid Tower White Tempered Glass Side Panel",
    "manufacturer": "Antec",
    "part_numbers": [
      "0-761345-10016-8                                                    NX416L White"
    ],
    "series": "NX416L",
    "variant": ""
  },
  "form_factor": "ATX Mid Tower",
  "color": [
    "WHITE"
  ],
  "power_supply": "None",
  "side_panel": "Tempered Glass",
  "has_transparent_side_panel": true,
  "front_panel_usb": "USB 3.2 Gen 1 Type-C                                                    USB 3.2 Gen 1 Type-A",
  "max_video_card_length": 415,
  "max_cpu_cooler_height": null,
  "internal_3_5_bays": 2,
  "internal_2_5_bays": 2,
  "expansion_slots": 7,
  "dimensions": "471 x 218 x 486",
  "volume": 49.902,
  "weight": null,
  "supported_power_supply_form_factors": [],
  "front_usb_ports": [],
  "general_product_information": {
    "amazon_sku": "B0CNVBCXMZ",
    "newegg_sku": "2AM-000V-001M3",
    "walmart_sku": 5529386596
  }
}