{
  "opendb_id": "d3c8923a-6576-435e-8cc5-ee4076e9edc4",
  "metadata": {
    "name": "Lian Li LANCOOL 206 ATX Mid Tower Black with Tempered Glass Side Panel and USB 3.2 Gen 1 Type-C / USB 3.2 Gen 1 Type-A",
    "manufacturer": "Lian Li",
    "part_numbers": [
      "G99.OE786RX.00                                                    G99.OE786RX.00AM"
    ],
    "series": "LANCOOL",
    "variant": ""
  },
  "form_factor": "ATX Mid Tower",
  "color": [
    "BLACK"
  ],
  "power_supply": "None",
  "side_panel": "Tempered Glass",
  "has_transparent_side_panel": true,
  "front_panel_usb": "USB 3.2 Gen 1 Type-C                                                    USB 3.2 Gen 1 Type-A",
  "max_video_card_length": 386,
  "max_cpu_cooler_height": null,
  "internal_3_5_bays": 3,
  "internal_2_5_bays": 0,
  "expansion_slots": 7,
  "dimensions": "462 x 220 x 488.2",
  "volume": 49.621,
  "weight": null,
  "supported_power_supply_form_factors": [],
  "front_usb_ports": [],
  "general_product_information": {
    "amazon_sku": "B0CQJVNL89"
  }
}