{
  "opendb_id": "e3ed09df-4925-45e4-bfbe-960872e61795",
  "metadata": {
    "name": "Zalman P30 AIR Micro ATX Mini Tower Black with Tempered Glass Side Panel and USB 3.2 Gen 1 Type-C / USB 3.2 Gen 1 Type-A",
    "manufacturer": "Zalman",
    "part_numbers": [
      "P30 AIR BLACK"
    ],
    "series": "P30",
    "variant": ""
  },
  "form_factor": "Micro ATX Mini Tower",
  "color": [
    "BLACK"
  ],
  "power_supply": "None",
  "supported_power_supply_form_factors": [],
  "side_panel": "Tempered Glass",
  "has_transparent_side_panel": true,
  "front_panel_usb": "USB 3.2 Gen 1 Type-C                                                    USB 3.2 Gen 1 Type-A",
  "front_usb_ports": [],
  "max_video_card_length": 392,
  "max_cpu_cooler_height": null,
  "internal_3_5_bays": 2,
  "internal_2_5_bays": 3,
  "expansion_slots": 5,
  "dimensions": "452 x 235 x 420",
  "volume": 44.612,
  "weight": null,
  "general_product_information": {}
}