{
  "opendb_id": "71d9e671-5494-4ede-b0e0-5625804f70a0",
  "metadata": {
    "name": "Zalman T7 ATX Compact Mid-Tower PC Case w/ Tempered Glass Side Panel",
    "manufacturer": "Zalman",
    "part_numbers": [],
    "series": "T7",
    "variant": null
  },
  "form_factor": "ATX Mid Tower",
  "power_supply": "None",
  "side_panel": "Acrylic",
  "has_transparent_side_panel": true,
  "front_panel_usb": "USB 3.0, USB 2.0 x 2",
  "max_video_card_length": 305,
  "max_cpu_cooler_height": 160,
  "internal_3_5_bays": 2,
  "internal_2_5_bays": 4,
  "expansion_slots": 7,
  "dimensions": "384 x 202 x 438",
  "volume": 0,
  "weight": 7.05,
  "color": [],
  "supported_power_supply_form_factors": [],
  "front_usb_ports": [],
  "general_product_information": {
    "amazon_sku": "B084H9CSWR",
    "walmart_sku": 3061694735
  }
}