{
  "opendb_id": "2ecce427-40cc-4a2d-b1ad-6c237f4d80b2",
  "metadata": {
    "name": "NZXT H7 Flow (2022) ATX Mid Tower White / Black with Tempered Glass Side Panel and USB 3.2 Gen 2x2 Type-C, USB 3.2 Gen 1 Type-A",
    "manufacturer": "NZXT",
    "part_numbers": [
      "CM-H71FG-01"
    ],
    "series": "H7",
    "variant": ""
  },
  "form_factor": "ATX Mid Tower",
  "color": [
    "WHITE",
    "BLACK"
  ],
  "power_supply": "None",
  "side_panel": "Tempered Glass",
  "has_transparent_side_panel": true,
  "front_panel_usb": "2x USB 3.2 Type-A                                                                USB 3.2 Gen 2x2 Type-C (20 Gbps) ",
  "max_video_card_length": 400,
  "max_cpu_cooler_height": 185,
  "internal_3_5_bays": 2,
  "internal_2_5_bays": 4,
  "expansion_slots": 7,
  "dimensions": "480 x 230 x 505",
  "volume": 55.752,
  "weight": 22.1564,
  "supported_power_supply_form_factors": [],
  "front_usb_ports": [
    "2x USB 3.2 Type-A",
    "1x USB 3.2 Gen 2x2 Type-C (20 Gbps) "
  ],
  "dimensions_mm": {
    "width": 230,
    "height": 505,
    "depth": 480,
    "_id": "68aaf46117889700c6fc45ca"
  },
  "general_product_information": {
    "amazon_sku": "B09VNRGT7S",
    "bestbuy_sku": 6507400,
    "walmart_sku": 777537281
  }
}