{
  "opendb_id": "b5e4a00f-66f1-4741-ba3d-2ae683fc2400",
  "metadata": {
    "name": "Cooler Master MasterCase MC600P ATX Mid Tower Black with Tempered Glass Side Panel and USB 3.2 Gen 1 Type-A USB 2.0 Type-A",
    "manufacturer": "Cooler Master",
    "part_numbers": [
      "MCM-M600P-KG5N-S00"
    ],
    "series": "MasterCase",
    "variant": ""
  },
  "form_factor": "ATX Mid Tower",
  "color": [
    "BLACK"
  ],
  "power_supply": "None",
  "side_panel": "Tempered Glass",
  "has_transparent_side_panel": true,
  "front_panel_usb": "USB 3.2 Gen 1 Type-A                                                    USB 2.0 Type-A",
  "max_video_card_length": 412,
  "max_cpu_cooler_height": null,
  "internal_3_5_bays": 4,
  "internal_2_5_bays": 2,
  "expansion_slots": 7,
  "dimensions": "544 x 235 x 548",
  "volume": 70.056,
  "weight": null,
  "supported_power_supply_form_factors": [],
  "front_usb_ports": [],
  "general_product_information": {}
}