{
  "opendb_id": "0d6fa5aa-ca60-4a6f-88e3-6de83706751f",
  "metadata": {
    "name": "Jonsbo Jonsplus Z20 Micro ATX Desktop White Tempered Glass Side Panel, USB 3.2 Gen 2 Type-C, USB 3.2 Gen 1 Type-A",
    "manufacturer": "Jonsbo",
    "part_numbers": [
      "Z20 White                                                    Z20 WH"
    ],
    "series": "Jonsplus",
    "variant": ""
  },
  "form_factor": "Micro ATX Desktop",
  "color": [
    "WHITE"
  ],
  "power_supply": "None",
  "side_panel": "Tempered Glass",
  "has_transparent_side_panel": true,
  "front_panel_usb": "USB 3.2 Gen 2 Type-C                                                    USB 3.2 Gen 1 Type-A",
  "max_video_card_length": 363,
  "max_cpu_cooler_height": 164,
  "internal_3_5_bays": 1,
  "internal_2_5_bays": 2,
  "expansion_slots": 4,
  "dimensions": "382 x 198 x 335",
  "volume": 25.338,
  "weight": 11,
  "supported_power_supply_form_factors": [],
  "front_usb_ports": [
    "1x USB 3.2 Gen 2 Type-C",
    "1x USB 3.2 Gen 1 Type-A"
  ],
  "dimensions_mm": {
    "width": 382,
    "height": 198,
    "depth": 335,
    "_id": "68aa0eab9272c65c63200332"
  },
  "general_product_information": {
    "amazon_sku": "B0CWQHNK48",
    "newegg_sku": "2AM-05GF-00011"
  }
}