{
  "opendb_id": "2e46ed1f-cbb0-447e-8ac4-c2e31a348f14",
  "metadata": {
    "name": "Fractal Design Define S2 Vision RGB",
    "manufacturer": "Fractal Design",
    "part_numbers": [
      "FD-CA-DEF-S2V-RGB-BK"
    ],
    "series": "Define S2 Vision",
    "variant": "RGB"
  },
  "form_factor": "ATX Mid Tower",
  "power_supply": null,
  "power_supply_included": false,
  "side_panel": "Tinted Tempered Glass",
  "has_transparent_side_panel": true,
  "front_panel_usb": "USB 3.1 Gen 2 Type-C, USB 3.0, USB 2.0",
  "max_video_card_length": 440,
  "max_cpu_cooler_height": 185,
  "internal_3_5_bays": 3,
  "internal_2_5_bays": 2,
  "expansion_slots": 7,
  "dimensions": "543 x 233 x 465",
  "volume": 55.9,
  "weight": 26.7,
  "color": [],
  "supported_power_supply_form_factors": [],
  "front_usb_ports": [],
  "general_product_information": {
    "amazon_sku": "B07RBTY768",
    "newegg_sku": "9SIAUNCHN60865",
    "walmart_sku": 456901363
  }
}