{
  "opendb_id": "cd9ca175-531a-403a-bd06-5fd0ecc91118",
  "metadata": {
    "name": "Jonsbo MOD5 ATX Mid Tower Black with Tempered Glass Side Panel and USB 3.2 Gen 2 Type-C USB 3.2 Gen 1 Type-A",
    "manufacturer": "Jonsbo",
    "part_numbers": [
      "MOD5 Black"
    ],
    "series": "MOD5",
    "variant": ""
  },
  "form_factor": "ATX Mid Tower",
  "color": [
    "BLACK"
  ],
  "power_supply": "None",
  "side_panel": "Tempered Glass",
  "has_transparent_side_panel": true,
  "front_panel_usb": "USB 3.2 Gen 2 Type-C                                                    USB 3.2 Gen 1 Type-A",
  "max_video_card_length": 400,
  "max_cpu_cooler_height": null,
  "internal_3_5_bays": 1,
  "internal_2_5_bays": 3,
  "expansion_slots": 7,
  "dimensions": "600 x 255 x 635",
  "volume": 97.155,
  "weight": null,
  "supported_power_supply_form_factors": [],
  "front_usb_ports": [],
  "general_product_information": {}
}