{
  "opendb_id": "73ae628d-0d71-4332-af5d-638b659cee50",
  "metadata": {
    "name": "Fractal Design North ATX Mid Tower Black Tempered Glass Side Panel",
    "manufacturer": "Fractal Design",
    "part_numbers": [
      "FD-C-NOR1C-02"
    ],
    "series": "North",
    "variant": "Tempered Glass"
  },
  "form_factor": "ATX Mid Tower",
  "color": [
    "BLACK"
  ],
  "power_supply": "None",
  "side_panel": "Tempered Glass",
  "has_transparent_side_panel": true,
  "front_panel_usb": "1 x USB 3.1 Gen 2 Type-C 2 x USB 3.0",
  "max_video_card_length": 355,
  "max_cpu_cooler_height": 170,
  "internal_3_5_bays": 2,
  "internal_2_5_bays": 2,
  "expansion_slots": 7,
  "dimensions": "447 x 215 x 469",
  "volume": 45.073,
  "weight": 16.9756,
  "supported_power_supply_form_factors": [],
  "front_usb_ports": [
    "1x USB 3.1 Gen 2 Type-C",
    "2x USB 3.0"
  ],
  "dimensions_mm": {
    "width": 215,
    "height": 469,
    "depth": 447,
    "_id": "688d2dd28801d2e84c88a03a"
  },
  "general_product_information": {
    "amazon_sku": "B09V8HNWW9",
    "newegg_sku": "N82E16811352204",
    "bestbuy_sku": 6602166,
    "walmart_sku": 2690115312,
    "manufacturer_url": "https://www.fractal-design.com/products/cases/north/north/chalk-white/"
  }
}