{
  "opendb_id": "419b99f1-2e0b-40ab-bfba-c82b970b3f42",
  "metadata": {
    "name": "NZXT Switch 810 ATX Full Tower Black with Acrylic Side Panel and USB 3.2 Gen 1 Type-A, USB 2.0 Type-A Front Panel",
    "manufacturer": "NZXT",
    "part_numbers": [
      "CA-SW810-B1                                                    CSNZSW810B"
    ],
    "series": "Switch",
    "variant": ""
  },
  "form_factor": "ATX Full Tower",
  "color": [
    "BLACK"
  ],
  "power_supply": "None",
  "side_panel": "Acrylic",
  "has_transparent_side_panel": true,
  "front_panel_usb": "USB 3.2 Gen 1 Type-A                                                    USB 2.0 Type-A",
  "max_video_card_length": 375,
  "max_cpu_cooler_height": null,
  "internal_3_5_bays": 6,
  "internal_2_5_bays": 0,
  "expansion_slots": 9,
  "dimensions": "234 x 595 x 584",
  "volume": 81.31,
  "weight": null,
  "supported_power_supply_form_factors": [],
  "front_usb_ports": [],
  "general_product_information": {}
}