{
  "opendb_id": "5852698f-51a8-4d6c-8ccb-cb031be92923",
  "metadata": {
    "name": "SHARKOON BW9000 ATX Mid Tower Black with Acrylic Side Panel and USB 3.2 Gen 1 Type-A, USB 2.0 Type-A",
    "manufacturer": "SHARKOON",
    "part_numbers": [
      "4044951017935"
    ],
    "series": "BW9000",
    "variant": ""
  },
  "form_factor": "ATX Mid Tower",
  "color": [
    "BLACK"
  ],
  "power_supply": "None",
  "side_panel": "Acrylic",
  "has_transparent_side_panel": true,
  "front_panel_usb": "USB 3.2 Gen 1 Type-A                                                    USB 2.0 Type-A",
  "max_video_card_length": 430,
  "max_cpu_cooler_height": null,
  "internal_3_5_bays": 5,
  "internal_2_5_bays": 2,
  "expansion_slots": 7,
  "dimensions": "",
  "volume": null,
  "weight": null,
  "supported_power_supply_form_factors": [],
  "front_usb_ports": [],
  "general_product_information": {}
}