{
  "opendb_id": "469f9d59-a72a-46a2-acec-faac110960f1",
  "metadata": {
    "name": "DIYPC ARGB-Q1.V2 Micro ATX Mini Tower Black Tempered Glass Side Panel, Front USB Type-C and USB 2.0",
    "manufacturer": "DIYPC",
    "part_numbers": [
      "ARGB-Q1.V2-BK"
    ],
    "series": "ARGB-Q1.V2",
    "variant": ""
  },
  "form_factor": "Micro ATX Mini Tower",
  "color": [
    "BLACK"
  ],
  "power_supply": "None",
  "side_panel": "Tempered Glass",
  "has_transparent_side_panel": true,
  "front_panel_usb": "USB 3.2 Gen 1 Type-C                                                    USB 2.0 Type-A",
  "max_video_card_length": 340,
  "max_cpu_cooler_height": null,
  "internal_3_5_bays": 1,
  "internal_2_5_bays": 2,
  "expansion_slots": 5,
  "dimensions": "",
  "volume": null,
  "weight": null,
  "supported_power_supply_form_factors": [],
  "front_usb_ports": [],
  "general_product_information": {
    "newegg_sku": "N82E16811353245"
  }
}