{
  "opendb_id": "dcf8ffdb-3e88-461c-95eb-996c38f386d7",
  "metadata": {
    "name": "SHARKOON VS8 RGB ATX Mid Tower Black Tempered Glass Side Panel",
    "manufacturer": "SHARKOON",
    "part_numbers": [
      "4044951039081"
    ],
    "series": "VS8",
    "variant": ""
  },
  "form_factor": "ATX Mid Tower",
  "color": [
    "BLACK"
  ],
  "power_supply": "None",
  "side_panel": "Tempered Glass",
  "has_transparent_side_panel": true,
  "front_panel_usb": "USB 3.2 Gen 2 Type-C                                                    USB 3.2 Gen 1 Type-A",
  "max_video_card_length": 350,
  "max_cpu_cooler_height": null,
  "internal_3_5_bays": 2,
  "internal_2_5_bays": 6,
  "expansion_slots": 7,
  "dimensions": "423 x 205 x 485",
  "volume": 42.057,
  "weight": null,
  "supported_power_supply_form_factors": [],
  "front_usb_ports": [],
  "general_product_information": {}
}